{
  "$schema": "http://json-schema.org/draft-07/schema#",
  "title": "IndigoMovieManager WPF skin",
  "type": "object",
  "properties": {
    "name": { "type": "string" },
    "colorProfile": {
      "type": "string",
      "enum": ["light", "dark"],
      "description": "指定時は JSON の色をそのまま使い、アプリのテーマ切替ではリマップしない。省略時はアプリの Light/Dark/System に追従する。"
    },
    "type": { "type": "string" },
    "surface": {
      "type": "object",
      "properties": {
        "background": { "$ref": "#/definitions/color" }
      },
      "additionalProperties": true
    },
    "styles": {
      "type": "object",
      "additionalProperties": {
        "type": "object",
        "properties": {
          "foreground": { "$ref": "#/definitions/color" },
          "background": { "$ref": "#/definitions/color" }
        },
        "additionalProperties": true
      }
    },
    "thumbnail": {
      "type": "object",
      "additionalProperties": true
    },
    "card": {
      "type": "object",
      "properties": {
        "background": { "$ref": "#/definitions/color" },
        "layout": { "$ref": "#/definitions/layoutNode" }
      },
      "additionalProperties": true
    }
  },
  "definitions": {
    "color": {
      "type": "string",
      "format": "color",
      "pattern": "^#([0-9a-fA-F]{3}|[0-9a-fA-F]{6})$"
    },
    "layoutNode": {
      "type": "object",
      "properties": {
        "foreground": { "$ref": "#/definitions/color" },
        "background": { "$ref": "#/definitions/color" },
        "children": {
          "type": "array",
          "items": { "$ref": "#/definitions/layoutNode" }
        }
      },
      "additionalProperties": true
    }
  }
}
